slide_number,step_number,step_heading,text
1,1,Theme Selection,Ek professional aur attractive theme choose karen jo aapki product category ke saath match karta ho. Shopify pe bohat saare free aur paid themes mojood hain.
2,2,Color Scheme,Apne brand ki personality ko reflect karne wale colors ka istamal karen. Ek consistent color scheme use karen pure store mein.
3,3,Banner Images,High-quality aur engaging banner images use karen jo aapki products ko highlight karen aur customers ko attract karen.  Slideshow bhi use kar sakte hain.
4,4,Product Placement,Apni products ko strategically place karen taake woh easily visible hon.  Best-selling products ko highlight karen.
5,5,Mobile Optimization,Check karen ke aapki store mobile devices pe bhi properly dikh raha hai.  Mobile users bohat zyada hain aajkal.
