slide_number,step_number,step_heading,text
1,1,Shopify Seekhen!,"Sabse pehle Shopify platform ko ache se seekhen.  Iske features, policies aur optimization techniques samajhna bohat zaroori hai."
2,2,Digital Marketing aur SEO Seekhen!,Apne store ko successful banane ke liye digital marketing aur SEO zaruri hai. Paid aur organic traffic dono pe focus karen.
3,3,Niche Selection!,Sahi niche choose karna bohat important hai. Kam competition wali aur zyada demand wali niche dhundhen.
4,4,Store Optimization!,Apna store mobile-friendly aur user-friendly banayen.  Loading speed aur navigation pe dhyan den.
5,5,Customer Support!,Customer support bohat important hai.  Timely replies aur ache service se customers ko khush rakhen.
6,6,Reliable Sourcing!,Agar drop shipping kar rahe hain tou reliable suppliers dhundhen jo ache quality products timely deliver karen.
7,7,Multiple Suppliers!,Ek supplier pe depend na rahen. Multiple suppliers rakhne se risks kam hote hain.
